author_username,created_at,geotagging_bbox,geotagging_confidence,geotagging_lat,geotagging_lon,place_coordinates,place_full_name,text,url
MattWallace888,1692460622000,,,,,,,"🚨 MAUI FIRES DISTURBING TRUTH REVEALED 🚨

⚠️ WARNING: What You Are About To See is EXTREMELY AGGRAVATING/UPSETTING ⚠️

This Article Was Written and Sent To Me By A Maui Local Born and Raised There. He Currently Lives in Lahania and Knows Some of These Officials Personally.

When I Asked To Include His Name, He Said: “I don’t want any clout. I send this out of love for Maui and its people. I hope something like this never happens again.”

As You Read This, Please Consider Sharing! All Ad Revenue From This Tweet Will Be Donated DIRECTLY (Through Local Sources) To Maui Fire Victims! WE MUST SPREAD THIS INFORMATION FAR & WIDE TO PREVENT IT FROM HAPPENING AGAIN ANYWHERE! Each Like/Retweet Equals Money Going To Families Who Need It!

HERE ARE HIS EXTREMELY POWERFUL WORDS:

“First let me start off by saying Lahaina is a desert climate and has been since plantation owners rerouted the water source to other parts of the island. Lahaina used to be a lush landscape.

The infrastructure has largely remained the same since its inception. This means a cluttered nest of wires and rotting buildings. We have fires every year due to fallen electric lines. This isn’t something new.

In my opinion, this disaster could’ve been completely prevented had they spent the money to upgrade to in-ground electric lines. Many have asked over the years but were told there was no funds to do it. It’s a lot easier to secure funding after a disaster.

At the very least, HECO (the electric company) could’ve cut the power a lot sooner. HECO CEO Shelee Kimora claimed it could’ve affected specialized medical equipment. This is crazy considering you can’t use medical equipment if it’s incinerated by a fire. Just another excuse to avoid accountability.

The state of the art “all hazard” sirens never went off. Herman Andaya (Maui EMA director) who was in charge of making the decision to turn on the sirens said he didn’t regret it. The next day he resigned due to “health issues”.

No cell service and no loudspeaker either. There was no warning of any sort. People were in their houses and completely unaware until it the fire was close. There was a fire earlier and the Maui Fire Department said it was “100% contained”.

The police allowed incoming traffic into the town coming from Kaanapali but closed the road off on the other side due to a downed line that wasn’t even blocking the road. This caused a gridlock.

Residents' water was turned off with no way to protect their houses. Firefighters ran out of water and were denied access by Kaleo Manuel (DLNR’s deputy director for water resource management) until it was too late. This unnecessarily put firefighters at even greater risk.

I am especially embarrassed with leadership treating locals like criminals. They immediately enacted a roadblock (they could’ve just closed the fire zone) and implemented a military-enforced curfew 10pm - 6pm. There has also been a near-total media block in the fire zone. This is unconstitutional!

Many residents believe they have been soft selling the body count and knew they were hundreds of bodies that they collected the first day. Most of which are likely to be children who stayed home, without any cell service or power. Rumors of them filling containers with bodies and stacking them up in non refrigerated buildings. I suspect they’re trying to keep numbers down until the news cycle is over.

Despite not providing aid themselves, they have made it incredibly hard for residents to help by blocking the wharf and turning away boats with local aid, they blocked the roads, FEMA has been confiscating pallets of aid claiming it’s not fema approved items and they are not trained to distribute them.

Maui’s Mayor Bissen has acted like a bully throughout this entire mess. Just recently he threw a fit and tried to close down the press conference after a reporter asked “how many children are missing?”

The people need transparency and accountability and independent reporters who won’t be bullied!”",https://twitter.com/MattWallace888/status/1692928669067464993
BarackObama,1692124612000,,,,,,,"If you’re looking for more ways to support folks in Lāhainā and on Maui, I hope you’ll consider donating to these local organizations that are providing direct support on the ground: https://t.co/BvyE6YkBUy",https://twitter.com/BarackObama/status/1691519341706051586
MattWallace888,1692433755000,,,,,,,"⚠️ A Maui Local, TURNED WHISTLEBLOWER, Just Sent Me PAGES of Inside Information EXPOSING THE DISTURBING TRUTH About The Maui Fires. WHEN YOU SEE THIS IT IS GOING TO MAKE YOU SICK TO THE STOMACH!

I Will Be Posting EVERYTHING! ALL OF THE DEAD CHILDREN DESERVE JUSTICE! https://t.co/4i03pBMMsq",https://twitter.com/MattWallace888/status/1692815980949348593
HumanDilemma_,1692660073000,,,,,,,"Maui Fire - Hmm... what is going on here?? 👀

#biden #Lahaina #fire #Maui #MauiFire #hawaiifire #Hawaii https://t.co/PCDcpJqqAt",https://twitter.com/HumanDilemma_/status/1693765227173552287
RonFilipkowski,1692536907000,,,,,,,"Right-wing “independent journalist” who flew in to Maui (he also went into E. Palestine) after the fire is confronted by angry residents while live on Steve Bannon’s show, who said he is exploiting them for politics and using up precious resources. https://t.co/hpSIMX9kbH",https://twitter.com/RonFilipkowski/status/1693248630763700536
MattWallace888,1692427833000,,,,,,,🚨 THE DATABASE OF MISSING PEOPLE FROM THE MAUI FIRES STILL HAS OVER 1000 NAMES 10 DAYS AFTERWARDS ⚠️ THE GOVERNMENT IS BLATANTLY LYING WHEN THEY ESTIMATE AROUD 100 DEATHS ⚠️ THEY ARE TRYING TO COVER UP THE TRUTH 🚨 https://t.co/BH4N9Mq4aC,https://twitter.com/MattWallace888/status/1692791140712362055
BillyM2k,1692149346000,,,,,,,"a family who survived the maui fires by fleeing to the ocean for 5 hours and documented it 

please do more for them, @POTUS https://t.co/7vB7LC49Zj",https://twitter.com/BillyM2k/status/1691623082224681379
HumanDilemma_,1692661609000,,,,,,,"Maui Fire - How the First Lady Jill Biden acts👀💩🤮

 #biden #Lahaina #fire #Maui #MauiFire #hawaiifire #Hawaii https://t.co/uNwCHHmyW1",https://twitter.com/HumanDilemma_/status/1693771670861824080
JamesSurowiecki,1692191548000,,,,,,,"Obama's estate was spared from the Maui fires because it's on Oahu. https://t.co/AMPS7iDsXf",https://twitter.com/JamesSurowiecki/status/1691800091848266139
MattWallace888,1692503103000,,,,,,,⚠️ Pretty Incredible How The Maui Fires Were Smart Enough To Miss Government Buildings and Blackrock Owned Banks https://t.co/jtpDNR9Gsc,https://twitter.com/MattWallace888/status/1693106846855238031
TaraBull808,1692158800000,,,,,,,"It's cute that the NY Post wants to label anyone asking questions conspiracy theorists, but maybe if they did their job, we wouldn't have to.

You don't need to be a conspiracy theorist to know something isn't right with the Maui, Hawaii fires.

Why didn't they maintain the trees near powerlines?

Why didn't they cut the power in the high winds?

Why didn't they sound sirens once the fires started?

Why didn't they let people leave?

Why didn't they rescue people trapped in the water?

Why didn't insurance companies tell people their homes violated code before they burned?

Why didn't the fire affect any of the elite estates?

Why are they already making plans to take the land from the people?

Why aren't you asking more questions?",https://twitter.com/TaraBull808/status/1691662734105227688
cwebbonline,1692155814000,,,,,,,"This incredible Maui rescue story…

Lahaina resident Jubee Bedoya was trying to escape the incredibly fast moving fire by making a desperate run for the ocean when he encountered a family of five from California. The father handed him his two year-old son, and they waited into the water together.

The child is seen clinging to Bedoya’s neck as the group held onto a piece of floating wood. Bedoya said they were in the water for 2 to 3 hours. They were among 17 people rescued by the Coast Guard.",https://twitter.com/cwebbonline/status/1691650210727145766
lincolnmjay,1692659613000,,,,,"[[20.855885,-156.690186],[20.9416557,-156.690186],[20.9416557,-156.657928],[20.855885,-156.657928],[20.855885,-156.690186]]","Lahaina, HI","MAUI FIRE: NOT SO WARM WELCOME for JOE BIDEN as he arrives in Lahaina. 

The president’s 20+ vehicle motorcade is welcomed with a local giving them the middle finger. 

“The whole system in place in our government, in the USA is corrupt”.

https://t.co/v1EvqUvcTm https://t.co/TkXz05iCgw",https://twitter.com/lincolnmjay/status/1693763296283820085
WallStreetApes,1692083371000,,,,,,,"Many people are caught up on the pathetic $700 payment per household for the Maui Hawaii Fires but did anyone else notice the word choice they used when posting this from Biden’s account?

‘Laser-Focused’…? Interesting choice of words when everyone is taking about DEWs. (Direct Energy Weapons). I don’t believe in coincidences, do you?

This is Hidden in Plain Sight.",https://twitter.com/WallStreetApes/status/1691346363844337664
MattWallace888,1692289837000,,,,,,,"🚨 WOKENESS IS RESPONSIBLE FOR MANY ADDITIONAL HEARTLESS DEATHS IN THE MAUI FIRES 🚨

M. Kaleo Manuel, The Hippie Hawaii State Official Responsible For Handling All Water Resources, NOW HAS BLOOD ON HIS HANDS ⚠️

Mr. Manuel, A WOKE IDIOT “OBAMA INAUGURAL LEADER”, KNEW PEOPLE WERE DYING… BUT STILL DEMANDED ‘West Maui Land Co.’ (and others) GET PERMISSION FROM A ‘Taro’ WHICH HAPPENS TO BE A HAWAIIAN TRADITIONAL FARM LOCATED DOWNSTREAM FROM THEM, TO ACCESS WATER!

Extremely Valuable Time Ticked By, COSTING HUMAN LIVES, Before Finally The Farm Gave “PERMISSION” For The Water. By then though… THE FIRE HAD SPREAD TOO FAR AND DESTROYED EVERYTHING IN IT’S WAY ⚠️

THIS WATER STANDOFF OCCURRED ALL THROUGHOUT THE FATEFUL DAY! HE WATCHED AS BODIES PILED UP AND STILL REFUSED TO CHOOSE WATER OVER WOKENESS!

SHOULD EVERY OFFICIAL RESPONSIBLE SO MANY MORE AVOIDABLE DEATHS BE THROWN IN PRISON FOR THEIR EVIL ACTIONS?",https://twitter.com/MattWallace888/status/1692212343738872210
G_Mortgage_LLC,1692660878000,,,,,,,"New homeowner? It’s not enough just to own a fire extinguisher – you have to know how to use it! Remember P.A.S.S!

With the devastating wildfires that have occurred on Maui, please consider donating to the Maui Strong Fund at https://t.co/Mj7s7Fngc8.

#hawaiicommunity https://t.co/7AmCXFDD1F",https://twitter.com/G_Mortgage_LLC/status/1693768603420791190
SirBatman65,1692662275000,,,,,,,"Maui Police created the gridlock that killed many people in Lahaina

People were fleeing the fire only to find the Honoapiilani Highway, the only way out of Lahaina, blocked by the Maui Police at a key bottleneck. https://t.co/q7JIeJ9zku",https://twitter.com/SirBatman65/status/1693774462305387007
charliekirk11,1692249847000,,,,,,,"Here is M. Kaleo Manuel, the Hawaii water official who refused to release water resources and let landowners fight the Maui fire, explaining his ""philosophy"" about water:

""Native Hawaiians treated water as one of the earthly manifestations of a god...We've become used to looking at water as something that we use, and not something that we revere...We can reconnect to that traditional value set.""

I'm sure all the victims of the Maui fire are grateful their leaders were focused on worshipping water rather than using it to save their lives.

H/T @jeremykauffman",https://twitter.com/charliekirk11/status/1692044616345014589
HumanDilemma_,1692661443000,,,,,,,"Maui Fire - Jill Biden: Aloha au ia 'oe 👀💩

#biden #Lahaina #fire #Maui #MauiFire #hawaiifire #Hawaii https://t.co/SjByujycM7",https://twitter.com/HumanDilemma_/status/1693770973491708213
MattWallace888,1692190027000,,,,,,,THE MAUI FIRES WERE NOT AN ACCIDENT,https://twitter.com/MattWallace888/status/1691793711561109854
Pismo_B,1692660283000,,,,,,,"This senile NUMNUT Biden jokes about how hot the ground is in Maui after a fire ripped through, killing hundreds.

https://t.co/I4H13wEA6T",https://twitter.com/Pismo_B/status/1693766107453391217
leslibless,1692290351000,,,,,,,"This house has been dubbed “The Red House That Survived Hawaii Fire.” 

10,000 homes in Maui were burnt down, yet this one survived. 

Pattie Tamura, 67, whose family owns the home, says her grandfather, who had worked at a local sugar mill, built it out of thick concrete, with the purpose of it being able to ‘endure anything,’ allowing him to enjoy his retirement in the 1950’s. Pattie is convinced it survived because of his knowledge and construction skills. 

God Bless Lahaina and everyone this has impacted. 🙏",https://twitter.com/leslibless/status/1692214501943259491
charliekirk11,1692057621000,,,,,,,"Trump offers his condolences to Maui fire victims, compares Biden’s response to East Palestine:

“To the families affected, I give you my love and sympathy. Nothing can ever replace your loved ones, but you will always have the memories and feel their great love surrounding and embracing you.”",https://twitter.com/charliekirk11/status/1691238360751443969
MattWallace888,1692504070000,,,,,,,"🚨 How Many of The Missing 1200 Maui Fire Victims are Children?!?!? IT’S BEEN 11 DAYS WITH NO ANSWER 🚨

⚠️ THEY SENT THE KIDS HOME FROM SCHOOL WHILE MOST PARENTS WERE AT WORK AND THE FLAMES WERE MOVING OVER 1 MILE PER MINUTE ⚠️",https://twitter.com/MattWallace888/status/1693110903951024491
OldRowSwig,1692659528000,,,,,,,Joe Biden out here making jokes about the Maui fire 😐 https://t.co/8UYrHMwfI8,https://twitter.com/OldRowSwig/status/1693762941965713440
MattWallace888,1692496594000,,,,,,,Should The Maui Officials Who Withheld Water During The Fires Be Arrested?,https://twitter.com/MattWallace888/status/1693079545081942267
Raw_News1st,1692661083000,,,,,,,"President Biden on his recent visit to #Maui during a speech;

""Another referred to fire cannot reach its roots what he said, fire cannot reach its roots"" https://t.co/bJeW0AGuh1",https://twitter.com/Raw_News1st/status/1693769462246154588
Chicago1Ray,1692488407000,,,,,,,"This is what a real Commander in Chief does when disaster strikes, yet (111) dead from the Maui fires, and Biden still missing in action https://t.co/SEfndGU3b5",https://twitter.com/Chicago1Ray/status/1693045209657937948
SriniSitaraman,1692660871000,,,,,,,"The area that was completely consumed by fire 🔥 in the island of Maui in Hawaii. 😞
Image source: New York Times https://t.co/ZOJ4k6pj9X",https://twitter.com/SriniSitaraman/status/1693768573196575057
davidkurten,1692176661000,,,,,,,"There is no way that a book about the Maui fires could have been written, edited and published on 10 Aug before the end of the period it is talking about (8 - 11 Aug), and all filled with climate change propaganda.
This was pre-planned. https://t.co/9t6JhR9hlU",https://twitter.com/davidkurten/status/1691737652565832076
TalkMullins,1692414352000,,,,,,,"MAUI!🚨 What is going on?! My friend who is a storm chaser that’s covered fires, hurricanes, tornadoes, floods, etc is saying this is unlike anything he’s ever seen. The Government is blocking aid, turning away volunteers, and securing the area like it’s a coverup of some sort. https://t.co/5tUNg5LbJO",https://twitter.com/TalkMullins/status/1692734600110301249
ChrisDJackson,1692660509000,"[51.418899,51.471403,5.9163824,6.013728]",0.9953339695930481,51.4371483,5.9799001,,,"📸  “Fire cannot reach its roots. That’s Maui. That’s America.” - President Joe Biden 🇺🇸 

The president was referencing a nearby historic banyan tree that is still standing after the fire, and has become a symbol of hope in the aftermath. https://t.co/m8lzMjLHZR",https://twitter.com/ChrisDJackson/status/1693767054912897435
nypost,1692096296000,"[18.86546,28.517269,-178.443593,-154.755792]",0.995267391204834,19.593801499999998,-155.42837009716908,,,"Today's cover: Joe Biden is indifferent to the Maui fires because he’ll win Hawaii anyway https://t.co/1M3ljKh1Xi https://t.co/HiPgSP7uI0",https://twitter.com/nypost/status/1691400576565641216
KarenJCurry1,1692660605000,"[20.5744337,21.031561,-156.697263,-155.9790919]",0.8134303689002991,20.802956799999997,-156.31068331602177,,,Stop Foreclosures on Maui - Maui Fire Relief Bill - Sign the Petition! https://t.co/i5X6YqUD0k via @Change,https://twitter.com/KarenJCurry1/status/1693767459629588908
JeanneMullahy1,1692661523000,,,,,,,Hawaii State Government Attempts Information Blackout On Maui Fire - Refuses Media Access | ZeroHedge https://t.co/CeIYo0V3Y8,https://twitter.com/JeanneMullahy1/status/1693771309073707117
19Goldstein84,1692659753000,,,,,,,"M. Kaleo Manuel, one of the inaugural OBAMA LEADERS with the OBAMA FOUNDATION

Manuel made the decision to withhold water from Maui Hawaii firefighters for 5 HOURS 

This wasnt ""Climate change"" It was power company that started the fire and this guy who let it spread. JAIL HIM🤬 https://t.co/kogW18RCkd",https://twitter.com/19Goldstein84/status/1693763884958601313
QasimRashid,1692661423000,"[20.5744337,21.031561,-156.697263,-155.9790919]",0.5968946218490601,20.802956799999997,-156.31068331602177,,,"New @HFUSA update from Lahaina in Maui.

Donate to support fire victims here: https://t.co/jTIHYM1Y3S

Sign up to tutor children here: https://t.co/ckKy4VtI0D https://t.co/x8FAEMWIrC",https://twitter.com/QasimRashid/status/1693770890788663406
Mikel_Jollett,1692458379000,"[24.396308,31.000968,-87.634896,-79.974306]",0.9302815198898315,27.7567667,-81.4639835,,,"Let’s see…

A hurricane in Los Angeles.

100° ocean water in Florida.

Half of Canada on fire.

And an entire town in Maui burned to the ground.

But yeah, “climate change is a hoax.”",https://twitter.com/Mikel_Jollett/status/1692919259817521594
h_reyth,1692661205000,"[20.5744337,21.031561,-156.697263,-155.9790919]",0.9953011274337769,20.802956799999997,-156.31068331602177,,,"Republicans - Calling out #Biden for not caring about #Lahaina. 

Biden - In Lahaina.

Biden visits fire-ravaged #Maui as search efforts continue, with more than 800 people still missing. https://t.co/r0WgwkogjX",https://twitter.com/h_reyth/status/1693769973838266862
MauiDerm,1692660612000,"[20.8555755,20.918344,-156.6949,-156.6503197]",0.6821491122245789,20.8738769,-156.6776784,,,"Lahaina Fire Day 12 Update: Recovery is in full swing as the road to Lahaina has reopened. Yet, much work remains. We're focused on a stopgap to regularly restock a refrigerated trailer for vital community supplies. Support us via Maui Strong Fund: https://t.co/NVTHwc3o5A https://t.co/U0uvuffxm2",https://twitter.com/MauiDerm/status/1693767486578077930
mhdksafa,1692503444000,"[2.6833228,2.7033228,-76.054592,-76.034592]",0.9935029149055481,2.6933228,-76.044592,,,"Maui, USA burned to the ground.
Kelowna, Canada is now burning.
Florida ocean water are boiling.
Los Angeles hurricanes crashing.
Greenland's ice sheet is collapsing.
China's rivers are drying up.
Europe is on fire…

And you still believe that, “climate change is a hoax.”",https://twitter.com/mhdksafa/status/1693108276324425941
HawaiiDelilah,1692661334000,"[20.5744337,21.031561,-156.697263,-155.9790919]",0.9695634841918945,20.802956799999997,-156.31068331602177,,,"During President Biden's visit to Maui, almost every official mentioned the significance of the Banyan Tree as a symbol of hope.  As I said from the beginning, fire may burn but it cannot touch our roots.  We will prevail.  #MauiStrong",https://twitter.com/HawaiiDelilah/status/1693770517441028172
SteveGuest,1692662306000,"[20.5744337,21.031561,-156.697263,-155.9790919]",0.9949643611907959,20.802956799999997,-156.31068331602177,,,"Joe Biden finally made his way to Maui. 

And… Total gibberish from Joe Biden:

""Another referred to fire cannot reach its roots what he said, fire cannot reach its roots""

 https://t.co/51xhemGzGG",https://twitter.com/SteveGuest/status/1693774591460544536
aboxoffrogs,1692661835000,null,0.586370050907135,20.827288,-156.33880449999998,,,"https://t.co/ryROLz8W37
MAUI FIRE BRAIN SYNDROME! 100% CONFIRMATION THAT MAUI WAS HIT WITH A D.E.W.",https://twitter.com/aboxoffrogs/status/1693772617155567814
ianmastersmedia,1692660839000,"[20.5744337,21.031561,-156.697263,-155.9790919]",0.9953466057777405,20.802956799999997,-156.31068331602177,,,"NOW at https://t.co/SjZyWpaheU | Troy Andrade - Biden's Visit to Maui Where 850 Are Missing After the Worst Fire in American History | @jomaburt - Guatemala Elects a Reformer in a Landslide | @globalsarang - The BRICS Summit in South Africa With China's Xi But Absent Putin https://t.co/GU9OcISWl0",https://twitter.com/ianmastersmedia/status/1693768439998054609
Veteran97178373,1692661818000,"[51.418899,51.471403,5.9163824,6.013728]",0.9530537724494934,51.4371483,5.9799001,,,"THE PRESIDENT MOVE
QUICK TO HELP MAUI
BIG FIRE, THEY GOT HELP
FROM AMERICA AND OTHERS
COUNTRY. GOOD
#BLUE",https://twitter.com/Veteran97178373/status/1693772548205633732
mossomo,1692661764000,"[20.5744337,21.031561,-156.697263,-155.9790919]",0.6735283136367798,20.802956799999997,-156.31068331602177,,,"#Archive: Maui Fire - Citizen Camera Phones

What do we have here?
If this film is authentic, then what we have here is picture proof of a DEW in Maui.
Wow, simply wow.

About the 40 second mark and you'll see it blowing up the block. https://t.co/HpCByaYacR",https://twitter.com/mossomo/status/1693772317925724391
ecotraveler,1692662168000,null,0.5446996688842773,20.827288,-156.33880449999998,,,"After touring the rubble of Front Street, President Joe Biden used Lahaina’s famous banyan tree as a metaphor for the Valley Isle and its residents, saying “the fire cannot reach its roots. That’s #Maui.”",https://twitter.com/ecotraveler/status/1693774013481500804
JesusBloodCross,1692659206000,null,0.7429130673408508,20.827288,-156.33880449999998,,,"Prepped for an Invasion - Maui Fire Deep Dive tied to the Bible 
https://t.co/JhEWlrI1zW",https://twitter.com/JesusBloodCross/status/1693761592314187808
uncsabreman,1692661316000,null,0.8353073000907898,20.827288,-156.33880449999998,,,"Vultures swooping in to steal up people's land after their communities are obliterated in a very suspect fire #maui https://t.co/BpZXfesZPT",https://twitter.com/uncsabreman/status/1693770439078649994
ecotraveler,1692662132000,null,0.8333143591880798,21.3199435,-157.799589,,,"VIDEO: The nation ‘grieves with you,’ President Biden tells Maui | Honolulu Star-Advertiser https://t.co/6NKqP5Nz5M",https://twitter.com/ecotraveler/status/1693773862260068773
DeaconBlues0,1692292026000,"[20.5744337,21.031561,-156.697263,-155.9790919]",0.9700883626937866,20.802956799999997,-156.31068331602177,,,"Even MSNBC won't give Biden a break:
Katy Tur: so what do you think about the poor response from FEMA?
Maui resident: FEMA was great, they were here before the fires were out.",https://twitter.com/DeaconBlues0/status/1692221528279036339
diane_menefee,1692660633000,null,0.3664121627807617,20.827288,-156.33880449999998,,,Maui Fire Insurance WARNING https://t.co/hmpkkt8pi0 via @YouTube,https://twitter.com/diane_menefee/status/1693767576424178081
CindyElbertIns,1692662261000,"[20.8555755,20.918344,-156.6949,-156.6503197]",0.5658417344093323,20.8738769,-156.6776784,,,"Within 48 hours of the onset of the fire in Lahaina, Maui, a Mobile Medics International crew (doctor, paramedic, EMT & nurse) had boots on the ground and was ready to get to work. It would take 72 hours before they were able to do so. https://t.co/KyreEFTgV5",https://twitter.com/CindyElbertIns/status/1693774403702763883
SmileyCup1,1692661868000,"[20.5744337,21.031561,-156.697263,-155.9790919]",0.9213054776191711,20.802956799999997,-156.31068331602177,,,"One would think that climate change believers would have a plan in place to mitigate, not ignore potential situations that led up to the Maui fire. Someone dropped the ball. People died. Awaiting the cause of the fire…",https://twitter.com/SmileyCup1/status/1693772756406370363
JamesSu58706141,1692661624000,null,0.34647729992866516,20.827288,-156.33880449999998,,,Locals Tell What REALLY Happened Maui Fire https://t.co/SDeThygGnd via @YouTube,https://twitter.com/JamesSu58706141/status/1693771732027666750
Sonoluminesenc1,1692662038000,null,0.8289101719856262,20.827288,-156.33880449999998,,,"Thor system maui? #dew #maui #fire Check out SaveLahainaNatives's video! #TikTok https://t.co/oASkS4dswm",https://twitter.com/Sonoluminesenc1/status/1693773468700164123
CharlesPDavis,1692662318000,"[20.5744337,21.031561,-156.697263,-155.9790919]",0.833163857460022,20.802956799999997,-156.31068331602177,,,".⁦@POTUS⁩ visits fire-ravaged Maui as search efforts continue, with more than 800 people still missing - CNN Politics https://t.co/cYG7ibiyQ6",https://twitter.com/CharlesPDavis/status/1693774643289543022
kcomodity,1692659809000,"[20.5744337,21.031561,-156.697263,-155.9790919]",0.9953054785728455,20.802956799999997,-156.31068331602177,,,ABC News Prime: Biden tours Maui fire damage; Bond set for Trump in GA c... https://t.co/8jy71ZZ7Ke via @YouTube,https://twitter.com/kcomodity/status/1693764121370476618
neverlosetruth,1692659047000,null,0.7740752100944519,20.827288,-156.33880449999998,,,"Maui Fires - Directed Energy Weapons and Geoengineering, And White Dust In Sky The Day Before The Fire
https://t.co/4HKgHeM1q8",https://twitter.com/neverlosetruth/status/1693760922429632940
Isaleserrec,1692661957000,null,0.43376773595809937,20.827288,-156.33880449999998,,,🔥💥⚡📡⚡💥🔥The Truth about Maui Fire Brain Syndrome❗ - 100% Confirmation That Maui Was Hit a D.E.W. https://t.co/I5LIciLJVl #Odysee via @OdyseeTeam,https://twitter.com/Isaleserrec/status/1693773127493280005
